Word,Phonetic,Definition,Example,POS
ascend,/əˈsɛnd/,"To move upward, to fly, to soar.",He ascended to heaven upon a cloud.,verb
ascent,/əˈsɛnt/,The act of ascending; a motion upwards.,He made a tedious ascent of Mont Blanc.,noun
catalonia,/catalonia/,a region of northeastern Spain,,n
lactic,/ˈlæktɪk/,"Of, relating to, or derived from milk",,adjective
matterhorn,/matterhorn/,"a mountain in the Alps on the border between Switzerland and Italy (14,780 feet high); noted for its distinctive shape",,n
pyrenees,/pyrenees/,a chain of mountains between France and Spain,,n
sherpa,/ˈʃɜː(ɹ)pə/,"A mountain guide or porter, particularly a male of the Sherpa people so employed.",,noun
ultra,/ˈʌltɹə/,An ultraroyalist in France.,,noun
